key,de-DE,en-US,it-IT,es-ES
custom.data.type.html-editor.name,HTML Editor,HTML Editor,HTML Editor,HTML Editor
custom.data.type.html-editor.editor.window.open-button|text,Öffnen Sie den HTML-Editor in einem neuen Fenster,Open the HTML Editor in a new window,Open the HTML Editor in a new window,Abrir el editor HTML en una nueva ventana
custom.data.type.html-editor.editor.editing-placeholder,"Der HTML-Editor ist in einem anderen Fenster geöffnet, schließen Sie es, um die Änderungen zu sehen.","The HTML Editor is open in a different window, close it to see the changes.","The HTML Editor is open in a different window, close it to see the changes.","El editor HTML está abierto en una ventana diferente, ciérrala para ver los cambios."
custom.data.type.html-editor.editor.window.alert.is-open,"Der HTML-Editor ist in einem anderen Fenster geöffnet, schließen Sie es, um die Änderungen zu speichern.","The HTML Editor is open in a different window, close it to save the changes.","The HTML Editor is open in a different window, close it to save the changes.","El editor HTML está abierto en una ventana diferente, ciérrala para guardar los cambios."
custom.data.type.html-editor.editor.window.title,HTML-Editor,HTML Editor,HTML Editor,Editor HTML
custom.data.type.html-editor.detail.iframe-open-label,"Der Inhalt ist derzeit in einem anderen Fenster geöffnet, schließen Sie es, um ihn noch einmal im Detail zu sehen.","The content is currently open in a different window, close it to see it again in the detail.","The content is currently open in a different window, close it to see it again in the detail.","El contenido está actualmente abierto en una ventana diferente, ciérrela para verlo de nuevo en detalle."
custom.data.type.html-editor.detail.window.open-button|text,Den Inhalt in einem neuen Fenster öffnen,Open the content in a new window,Open the content in a new window,Abrir el contenido en una nueva ventana
custom.data.type.html-editor.detail.window.title,Content of object  #%(_system_object_id)s,Content of object  #%(_system_object_id)s,Content of object  #%(_system_object_id)s,Content of object  #%(_system_object_id)s